{
  "app_id": "lotro",
  "name": "The Lord of the Rings Online",
  "winget_id": "StandingStoneGames.TheLordoftheRingsOnline",
  "steam_id": 212500,
  "website": "https://www.lotro.com",
  "directories": [
    {
      "id": "user_configs",
      "description": "User preferences, UI layouts, plugins, and screenshots",
      "default_path": "%USERPROFILE%\\Documents\\The Lord of the Rings Online",
      "category": "configs",
      "needs_mapping": true,
      "safe_for_stream": true,
      "recommended_storage": "streaming",
      "notes": "Contains UserPreferences.ini, keybindings, custom UI skins, and ABC music files."
    }
  ]
}
