{
    "app_id":  "vscode",
    "name":  "Visual Studio Code",
    "website":  "https://code.visualstudio.com",
    "install":  {
                    "method":  "winget",
                    "winget_id":  "Microsoft.VisualStudioCode",
                    "steam_id":  null,
                    "download_url":  null,
                    "default_target_directory":  null,
                    "guide_file":  null,
                    "post_install_script":  "post-install.ps1",
                    "instructions":  []
                },
    "directories":  [
                        {
                            "id":  "user_settings",
                            "description":  "Keybindings, user settings, and snippets",
                            "default_path":  "%APPDATA%\\Code\\User",
                            "category":  "configs",
                            "needs_mapping":  true,
                            "safe_for_stream":  true,
                            "recommended_storage":  "streaming",
                            "notes":  "Safe for streaming mount or dotfiles (chezmoi) management."
                        }
                    ]
}
