{
  "app_id": "beat_saber",
  "name": "Beat Saber",
  "winget_id": null,
  "steam_id": 620980,
  "website": "https://beatsaber.com",
  "directories": [
    {
      "id": "custom_levels",
      "description": "Custom Songs & Levels",
      "default_path": "%PROGRAMFILES(X86)%\\Steam\\steamapps\\common\\Beat Saber\\Beat Saber_Data\\CustomLevels",
      "category": "songs",
      "needs_mapping": true,
      "safe_for_stream": true,
      "recommended_storage": "streaming",
      "notes": "Large audio and map asset bundles; read-only during song play. Safe for streaming or secondary local drive."
    },
    {
      "id": "game_saves",
      "description": "Player scores, campaign progress, and settings",
      "default_path": "%USERPROFILE%\\AppData\\LocalLow\\Hyperbolic Magnetism\\Beat Saber",
      "category": "saves",
      "needs_mapping": true,
      "safe_for_stream": true,
      "recommended_storage": "streaming",
      "notes": "Standard JSON/binary save files."
    }
  ]
}
