{
    "app_id": "satisfactory",
    "name": "Satisfactory",
    "website": "https://www.satisfactorygame.com",
    "install": {
        "method": "steam",
        "winget_id": null,
        "steam_id": 526870,
        "download_url": null,
        "default_target_directory": null,
        "guide_file": null,
        "post_install_script": null,
        "instructions": []
    },
    "directories": [
        {
            "id": "game_saves",
            "description": "Factory Game World Saves",
            "default_path": "%LOCALAPPDATA%\\FactoryGame\\Saved\\SaveGames",
            "category": "saves",
            "needs_mapping": true,
            "safe_for_stream": true,
            "recommended_storage": "streaming",
            "notes": "Discrete compressed save files (.sav) created sequentially. Contains blueprints subfolder. Safe for cloud streaming mount."
        }
    ]
}