{
  "$schema": "../_schema.json",
  "app_id": "python3",
  "name": "Python 3",
  "winget_id": "Python.Python.3.12",
  "steam_id": null,
  "website": "https://www.python.org",
  "install": {
    "method": "winget",
    "download_url": null,
    "default_target_directory": null,
    "guide_file": null,
    "post_install_script": null,
    "instructions": []
  },
  "directories": []
}
