{
  "$schema": "../_schema.json",
  "app_id": "google_drive",
  "name": "Google Drive for Desktop",
  "winget_id": "Google.GoogleDrive",
  "steam_id": null,
  "website": "https://www.google.com/drive/download/",
  "install": {
    "method": "winget",
    "download_url": null,
    "default_target_directory": null,
    "guide_file": null,
    "post_install_script": null,
    "instructions": []
  },
  "directories": []
}
